rank by tickets sold, total tickets sold, amphitheater name, city, state, total gross

2, 490557, Comcast Center, Mansfield, MA, $24028647.20
3, 477177, Susquehanna Bank Center, Camden, NJ ,$20167331.30
28, 206248, Hollywood Bowl, Los Angeles, CA ,$18524779.80
1, 688344, DTE Energy Music Theatre, Clarkston, MI, $18021021.60
8, 334422, Red Rocks Amphitheatre, Morrison, CO, $17502040.60
14, 273531, Nikon At Jones Beach Theater, Wantagh, NY, $16603466.20
6, 357524, The Cynthia Woods Mitchell Pavilion, The Woodlands, TX, $15456954.10
4, 380962, Filene Center At Wolf Trap, Vienna, VA ,$14411550.60
18, 245325, The Molson Amphitheatre, Toronto, CANADA, $14284955.60
7, 336107, Nissan Pavilion At Stone Ridge, Bristow, VA ,$14060161.10 
29, 204780, Greek Theatre, Los Angeles, CA ,$13794249.20
10, 305846, PNC Bank Arts Center, Holmdel, NJ ,$12989111.90
26, 211386, Chastain Park Amphitheatre, Atlanta, GA, $12893797.80
20, 240195, Gorge Amphitheatre, Quincy, WA, $12855885.30
35, 155367, Verizon Wireless Amph. At Encore Park ,Alpharetta, GA ,$12518396.20
5, 378141, Verizon Wireless Music Center, Noblesville, IN, $11995258.10
11, 290559, Superpages.com Center, Dallas, TX, $11813382.80
17, 251976, Verizon Wireless Amphitheater, Irvine, CA ,$11753975.70
9, 310936, Verizon Wireless Amph. St. Louis, Maryland Heights, MO, $10524143.80
13, 274815, New England Dodge Music Center, Hartford, CT ,$10451813.60
12, 279850, Verizon Wireless Amphitheatre, Charlotte, NC, $10274018.80
16, 257750, Shoreline Amphitheatre, Mountain View, CA ,$10030966.30
15, 269619, Time Warner Cable Music Pavilion ,Raleigh, NC, $9767119.60
21, 234884, Cruzan Amphitheatre, West Palm Beach, FL, $9627441.50
27, 210289, Cricket Wireless Amphitheatre, Chula Vista, CA, $9566668.80
30, 193022, Merriweather Post Pavilion, Columbia, MD, $9562896.00
23, 225796, Ford Amphitheatre @ State Fairgrds. ,Tampa, FL, $9448190.50
19, 240282, Riverbend Music Center, Cincinnati, OH, $9252878.40
22, 230289, Verizon Wireless Virginia Beach Amphitheater, Virginia Beach, VA, $8932328.30
25, 216215, Saratoga Performing Arts Center, Saratoga Springs, NY, $8856682.20
24, 223413, Blossom Music Center, Cuyahoga Falls, OH, $8415248.00
36, 140797, Greek Theatre, Berkeley, CA, $7761505.00
31, 187584, Lakewood Amphitheatre, Atlanta, GA, $7318949.00
33, 184854, Cricket Wireless Pavilion, Phoenix, AZ, $7221996.60
32, 186349, First Midwest Bank Amphitheatre, Tinley Park, IL, $6913417.50
48, 94959, The Mountain Winery, Saratoga, CA, $6619712.60
47, 98492, Santa Barbara Bowl, Santa Barbara, CA, $6236848.30
62, 65103, Waldbuhne, Berlin, GERMANY, $6074539.30
41, 123692, Post-Gazette Pavilion, Burgettstown, PA, $6038128.10
34, 160316, Verizon Wireless Amphitheater ,Selma, TX ,$5520657.30
40, 123797, White River Amphitheatre, Auburn, WA ,$5388349.70
42, 123658, Pavilion Stage At Bethel Woods Center For The Arts, Bethel, NY, $5241126.80
39, 126945, Bank Of America Pavilion, Boston, MA, $4936576.00
38, 129684, Journal Pavilion, Albuquerque, NM, $4926727.30
37, 137054, Fiddler's Green Amphitheatre, Englewood, CO, $4833526.30
43, 118266, Toyota Pavilion At Montage Mountain, Scranton, PA, $4707690.30
49, 93791, Sleep Train Pavilion At Concord, Concord, CA, $4566904.10
45, 106306, Darien Lake Performing Arts Center, Darien Center, NY, $4430152.30
69, 56166, Harveys Lake Tahoe Outdoor Arena, Stateline, NV, $4299030.00
64, 63134, Humphrey's Concerts By The Bay, San Diego, CA, $4295999.00
59, 66966, The Amphitheater At Clark County, Ridgefield, WA, $4024573.50
52, 86899, Usana Amphitheatre, Salt Lake City, UT, $3960523.50
46, 104803, Amphitheater At The Wharf, Orange Beach, AL, $3923106.50
50, 93552, Alpine Valley Music Theatre, East Troy, WI, $3778376.00
57, 73403, Marcus Amphitheater, Milwaukee, WI, $3728726.90
55, 74694, Starlight Theatre, Kansas City, MO, $3700594.70
53, 78006, Sleep Train Amphitheatre, Wheatland, CA, $3223041.60
68, 57057, Meadowbrook U.S. Cellular Pavilion, Gilford, NH, $3169440.00
81, 32763, Sidney Myer Music Bowl, Melbourne, AUSTRALIA, $3152871.40 
56, 74482, Constellation Brands - Marvin Sands PAC (CMAC), Canandaigua, NY, $3106704.50
58, 67831, Charter One Pav. @ Northerly Isl., Chicago, IL, $2997129.50
70, 54816, Mann Center For Performing Arts, Philadelphia, PA, $2768839.50
67, 61338, Marymoor Amphitheatre, Redmond, WA, $2582884.50
63, 64891, Verizon Wireless Center Birmingham, Pelham, AL, $2499524.70
51, 87380, Fraze Pavilion For The Perf. Arts, Kettering, OH, $2465478.50
54, 75749, San Manuel Amphitheater, Devore, CA, $2462672.20
66, 62479, Pier Six Pavilion, Baltimore, MD, $2417964.60
60, 66710, St. Augustine Amphitheatre, Saint Augustine, FL, $2196225.50
83, 31652, Ironstone Vineyards, Murphys, CA, $2164398.50
61, 65683, Festival Pier At Penn's Landing, Philadelphia, PA, $1993136.60
65, 62523, Capitol Federal Park At Sandstone, Bonner Springs, KS, $1886453.20
44, 116568, Meadow Brook Music Festival, Rochester, MI, $1752843.00
76, 38581, McMenamins Edgefield Amphitheater, Troutdale, OR, $1589154.00
74, 40792, McCarren Park Pool, Brooklyn, NY, $1519309.50
71, 53660, The Showgrounds @ Sam Houston Race Park, Houston, TX, $1498329.70
89, 27459, The Star Pavilion At Hersheypark Stadium, Hershey, PA, $1493280.30
79, 35576, National City Pavilion, Cincinnati, OH, $1469077.00
77, 37478, Riverplace Stage, Bethlehem, PA, $1447595.00
82, 32387, Les Schwab Amphitheater, Bend, OR, $1365983.00
84, 31367, Viejas Concerts In The Park, Alpine, CA, $1325187.50
80, 34292, Minnesota Zoo Amphitheater, Apple Valley, MN, $1310000.00
73, 41670, Time Warner Cable Amph.@Tower City, Cleveland, OH, $1278462.50
86, 29328, Oklahoma City Zoo Amphitheatre, Oklahoma City, OK, $1274054.50
91, 26633, Centre For The Arts At Mizner Park Amphitheatre, Boca Raton, FL, $1123492.30
85, 30727, Harrah's Casino - Stir Concert Cove, Council Bluffs, IA, $1109107.00
75, 40257, Koka Booth Amphitheatre At Regency Park, Cary, NC, $1000098.50
94, 23036, Rumsey Playfield / Central Park, New York, NY, $926181.00
78, 36777, Woodland Park Zoo, Seattle, WA, $833486.00
72, 50327, Oregon Zoo Amphitheatre, Portland, OR, $832476.00
90, 27386, Idaho Center Amphitheater, Nampa, ID, $755878.50
96, 21683, Bayfront Park Amphitheater, Miami, FL, $751847.00
92, 26466, Concrete Street Amphitheater, Corpus Christi, TX, $706461.00
87, 28875, Lawn at White River State Park, Indianapolis, IN, $685620.70
95, 22836, Cuthbert Amphitheater, Eugene, OR, $668016.00
97, 21357, Freedom Hill Amphitheatre, Sterling Heights, MI, $653544.20
100, 17620, SDSU Open Air Theatre, San Diego, CA, $561226.00
98, 18143, Masquerade Music Park, Atlanta, GA, $536070.00
93, 26056, Celeste Center, Columbus, OH, $526742.00
99, 17844, Mesa Amphitheatre, Mesa, AZ, $508956.50
88, 27797, Snowden Grove Amphitheater, Southaven, MS ,$433105.00